title,category
Dự luật thuế mới được Quốc hội phê chuẩn,Politics
Công ty công nghệ công bố lãi lớn kỷ lục,Business
Đội địa phương vô địch giải vô địch với trận chung kết kịch tính,Sports
Chính sách giáo dục mới nhằm cải thiện tỷ lệ biết chữ,Education
Mẹo giúp ngủ ngon và sức khỏe tinh thần tốt,Wellness
Ngôi sao Hollywood sẽ đóng chính trong bom tấn sắp tới,Entertainment
Chính phủ đối mặt với lời phê bình về chính sách môi trường,Politics
Thị trường dự báo sẽ bất ổn sau khi lãi suất tăng,Business
Vận động viên lập kỷ lục thế giới trong chặng 100m,Sports
Nghiên cứu mới cho thấy lợi ích của học trực tuyến,Education
Thói quen ăn uống khỏe mạnh giúp sống lâu,Wellness
Đạo diễn đoạt giải phát hành bộ phim mới,Entertainment
Vụ bê bối chính trị gây sóng gió toàn quốc,Politics
Start-up huy động triệu đô la trong vòng gọi vốn,Business
Đội địa phương tiến vào chung kết quốc gia,Sports
Các trường đại học áp dụng tiêu chí tuyển sinh mới,Education
Du lịch thiền và tĩnh tâm giảm stress,Wellness
Chương trình truyền hình được yêu thích có thêm mùa mới,Entertainment
Kết quả bầu cử được công bố giữa lúc gây tranh cãi,Politics
Dự báo kinh tế lạc quan mặc dù thách thức toàn cầu,Business
Thế vận hội hoãn do đại dịch,Sports
Chương trình Stem mới cho học sinh trung học,Education
Công thức ăn uống khỏe cho các chuyên gia bận rộn,Wellness
Diễn viên nổi tiếng tham gia vào phim hành động mới,Entertainment
Kết quả bầu cử ngoài dự kiến gây bất ngờ,Politics
Công ty khởi nghiệp phát triển công nghệ xanh,Business
Đội bóng địa phương thắng lớn trong trận quyết đấu,Sports
Giáo dục cấp tiểu học đổi mới với phương pháp học tập hiện đại,Education
Lối sống khỏe mạnh cho mùa hè sôi động,Wellness
Diễn viên nổi tiếng đồng ý tham gia vở kịch hài,Entertainment
Bê bối tài chính lớn nhất lịch sử công ty,Politics
Thị trường chứng khoán giảm mạnh sau tin tức xấu về doanh nghiệp lớn,Business
Cầu thủ vượt qua chấn thương nặng quay trở lại với đội,Sports
Các trường đại học đầu tư mạnh mẽ vào nghiên cứu sinh,Education
Cách thức luyện tập đơn giản giúp tăng cường sức khỏe,Wellness
Nữ diễn viên chính thức rời khỏi dự án phim,Entertainment
Chính phủ đưa ra biện pháp mới để giảm phát thải khí nhà kính,Politics
Doanh nghiệp công nghệ ra mắt sản phẩm mới đột phá,Business
Đội bóng quốc gia chuẩn bị cho vòng loại World Cup,Sports
Trường trung học cơ sở thực hiện chương trình học được đánh giá cao,Education
Cách thức dưỡng da tốt cho mùa hè,Wellness
Dự án phim hoạt hình thú vị dành cho cả gia đình,Entertainment
Phát hiện các đối tượng gây rối trật tự tại biên giới,Politics
Doanh nghiệp mới nổi đón đầu xu hướng thị trường,Business
Đội bóng mới chiêu mộ cầu thủ quốc tế nổi tiếng,Sports
Giáo dục phổ thông địa phương tăng cường giảng dạy kỹ năng sống,Education
Cách thức lựa chọn thực phẩm đúng cho dân văn phòng,Wellness
Nghệ sĩ hài nổi tiếng quay trở lại với show truyền hình,Entertainment